Sheet: sample.mlu.cex
A1: Using CLAN Command: freq +u *.cha +d2 +s@class_marker_full.cut
A2: File | B2: Code | C2: Role | D2: *AYY: | E2: *BAO: | F2: *CAA: | G2: *CH2: | H2: *CHI: | I2: *DDD: | J2: *DGG: | K2: *FAT: | L2: *INV: | M2: *JEE: | N2: *JJJ: | O2: *LLL: | P2: *LYY: | Q2: *MNN: | R2: *MOT: | S2: *NNN: | T2: *OBB: | U2: *OFF: | V2: *OGG: | W2: *OMM: | X2: *ONN: | Y2: *OPP: | Z2: *OYY: | AA2: *SSS: | AB2: *UNC: | AC2: *XGG: | AD2: *YYY: | AE2: bie2 | AF2: bu2 | AG2: bu4 | AH2: de | AI2: dei3 | AJ2: dian3 | AK2: dianr3 | AL2: nei3ge | AM2: nei4ge | AN2: yi2ge | AO2: zhei4ge | AP2: ge | AQ2: hai2 | AR2: le | AS2: mei2 | AT2: na4 | AU2: nei4 | AV2: neng2 | AW2: xu3 | AX2: ye3 | AY2: you4 | AZ2: zai4 | BA2: zhe | BB2: zhe4 | BC2: Types | BD2: Token | BE2: TTR
A3: bb011001,bb011013,bb011105,bb011130,bb020113,bb020207,bb020302,cx011009,cx011106,cx011108,cx011120,cx020018,hy010828,hy011000,hy011009,hy011105,hy011121,hy020004,lc010921,lc011005,lc011019,lc011113,lc020012,lc020119,lc020205,ll010906,ll010920,ll011003,ll011017,ll011028,ll020001,ll020027,ll020127,lxb010903,lxb010915,lxb011011,lxb011020,lxb011024,lxb011109,lxb020000,lxb020015,lxb020109,tt010903,tt010915,tt010930,tt011030,tt011128,tt020028,tt020122,ww011028,ww011113,ww011130,ww020024,ww020105,ww020120,ww020 | B3: CHI | C3: Target_Child | D3: 0 | E3: 0 | F3: 0 | G3: 0 | H3: 28464 | I3: 0 | J3: 0 | K3: 0 | L3: 0 | M3: 0 | N3: 0 | O3: 0 | P3: 0 | Q3: 0 | R3: 0 | S3: 0 | T3: 0 | U3: 0 | V3: 0 | W3: 0 | X3: 0 | Y3: 0 | Z3: 0 | AA3: 0 | AB3: 0 | AC3: 0 | AD3: 0 | AE3: 33 | AF3: 348 | AG3: 551 | AH3: 466 | AI3: 22 | AJ3: 11 | AK3: 12 | AL3: 2 | AM3: 39 | AN3: 71 | AO3: 448 | AP3: 226 | AQ3: 271 | AR3: 653 | AS3: 562 | AT3: 118 | AU3: 85 | AV3: 47 | AW3: 4 | AX3: 79 | AY3: 177 | AZ3: 196 | BA3: 70 | BB3: 265 | BC3: 24 | BD3: 4756 | BE3: 5.0000000000000001E-3
A4: bb011001,bb011013,bb011105,bb011130,bb020113,bb020207,bb020302,cx011009,cx011106,cx011108,cx011120,cx020018,hy010828,hy011000,hy011009,hy011105,hy011121,hy020004,lc010921,lc011005,lc011019,lc011113,lc020012,lc020119,lc020205,ll010906,ll010920,ll011003,ll011017,ll011028,ll020001,ll020027,ll020127,lxb010903,lxb010915,lxb011011,lxb011020,lxb011024,lxb011109,lxb020000,lxb020015,lxb020109,tt010903,tt010915,tt010930,tt011030,tt011128,tt020028,tt020122,ww011028,ww011113,ww011130,ww020024,ww020105,ww020120,ww020 | B4: INV | C4: Investigator | D4: 0 | E4: 0 | F4: 0 | G4: 0 | H4: 0 | I4: 0 | J4: 0 | K4: 0 | L4: 3197 | M4: 0 | N4: 0 | O4: 0 | P4: 0 | Q4: 0 | R4: 0 | S4: 0 | T4: 0 | U4: 0 | V4: 0 | W4: 0 | X4: 0 | Y4: 0 | Z4: 0 | AA4: 0 | AB4: 0 | AC4: 0 | AD4: 0 | AE4: 46 | AF4: 117 | AG4: 246 | AH4: 209 | AI4: 8 | AJ4: 3 | AK4: 14 | AL4: 0 | AM4: 73 | AN4: 47 | AO4: 120 | AP4: 9 | AQ4: 48 | AR4: 316 | AS4: 119 | AT4: 39 | AU4: 32 | AV4: 75 | AW4: 4 | AX4: 50 | AY4: 17 | AZ4: 77 | BA4: 16 | BB4: 22 | BC4: 23 | BD4: 1707 | BE4: 1.2999999999999999E-2
A5: bb011013,bb011105,bb011130,bb020113,cx011009,cx011106,cx011108,cx011120,cx020018,hy010828,hy011000,hy011009,hy011121,hy020004,lc010921,lc011113,lc020012,lc020119,ll010906,ll011028,ll020001,lxb010903,lxb011020,lxb011024,lxb020015,lxb020109,tt010903,tt010915,tt011030,tt011128,tt020028,ww011028,ww011130,ww020105,ww020120,ww020304,wx010927,wx011118,wx020026,wx020104,wx020120,yy011020,yy020000,yy020025,yy020119,yy020218 | B5: MOT | C5: Mother | D5: 0 | E5: 0 | F5: 0 | G5: 0 | H5: 0 | I5: 0 | J5: 0 | K5: 0 | L5: 0 | M5: 0 | N5: 0 | O5: 0 | P5: 0 | Q5: 0 | R5: 33333 | S5: 0 | T5: 0 | U5: 0 | V5: 0 | W5: 0 | X5: 0 | Y5: 0 | Z5: 0 | AA5: 0 | AB5: 0 | AC5: 0 | AD5: 0 | AE5: 499 | AF5: 1178 | AG5: 1736 | AH5: 1404 | AI5: 103 | AJ5: 67 | AK5: 348 | AL5: 77 | AM5: 431 | AN5: 466 | AO5: 789 | AP5: 231 | AQ5: 721 | AR5: 4383 | AS5: 956 | AT5: 458 | AU5: 550 | AV5: 325 | AW5: 112 | AX5: 387 | AY5: 437 | AZ5: 700 | BA5: 604 | BB5: 486 | BC5: 24 | BD5: 17448 | BE5: 1E-3
A6: bb011013,bb020207,lxb010903,lxb020109,yy011020,yy020218 | B6: BAO | C6: Caretaker | D6: 0 | E6: 1428 | F6: 0 | G6: 0 | H6: 0 | I6: 0 | J6: 0 | K6: 0 | L6: 0 | M6: 0 | N6: 0 | O6: 0 | P6: 0 | Q6: 0 | R6: 0 | S6: 0 | T6: 0 | U6: 0 | V6: 0 | W6: 0 | X6: 0 | Y6: 0 | Z6: 0 | AA6: 0 | AB6: 0 | AC6: 0 | AD6: 0 | AE6: 22 | AF6: 72 | AG6: 70 | AH6: 111 | AI6: 2 | AJ6: 2 | AK6: 11 | AL6: 2 | AM6: 12 | AN6: 9 | AO6: 26 | AP6: 1 | AQ6: 29 | AR6: 193 | AS6: 54 | AT6: 31 | AU6: 31 | AV6: 10 | AW6: 1 | AX6: 20 | AY6: 30 | AZ6: 37 | BA6: 33 | BB6: 1 | BC6: 24 | BD6: 810 | BE6: 0.03
A7: bb011013,cx020018,hy011000,ll011028,ll020001,ll020027,lxb011020,lxb011024,lxb020000,tt010903,tt010915,ww011028,ww020304,yy011020 | B7: CH2 | C7: Child | D7: 0 | E7: 0 | F7: 0 | G7: 536 | H7: 0 | I7: 0 | J7: 0 | K7: 0 | L7: 0 | M7: 0 | N7: 0 | O7: 0 | P7: 0 | Q7: 0 | R7: 0 | S7: 0 | T7: 0 | U7: 0 | V7: 0 | W7: 0 | X7: 0 | Y7: 0 | Z7: 0 | AA7: 0 | AB7: 0 | AC7: 0 | AD7: 0 | AE7: 1 | AF7: 6 | AG7: 13 | AH7: 10 | AI7: 1 | AJ7: 0 | AK7: 1 | AL7: 0 | AM7: 4 | AN7: 3 | AO7: 3 | AP7: 2 | AQ7: 2 | AR7: 26 | AS7: 19 | AT7: 8 | AU7: 0 | AV7: 1 | AW7: 0 | AX7: 3 | AY7: 0 | AZ7: 1 | BA7: 3 | BB7: 0 | BC7: 18 | BD7: 107 | BE7: 0.16800000000000001
A8: bb011013,cx020018,hy011000,lc020012,ll020027,lxb011020,lxb020000,lxb020015,tt010903,tt010915,ww011028,ww011130,ww020304,wx011118,yy011020,yy020000 | B8: OMM | C8: Adult | D8: 0 | E8: 0 | F8: 0 | G8: 0 | H8: 0 | I8: 0 | J8: 0 | K8: 0 | L8: 0 | M8: 0 | N8: 0 | O8: 0 | P8: 0 | Q8: 0 | R8: 0 | S8: 0 | T8: 0 | U8: 0 | V8: 0 | W8: 916 | X8: 0 | Y8: 0 | Z8: 0 | AA8: 0 | AB8: 0 | AC8: 0 | AD8: 0 | AE8: 8 | AF8: 55 | AG8: 50 | AH8: 68 | AI8: 7 | AJ8: 3 | AK8: 22 | AL8: 0 | AM8: 13 | AN8: 9 | AO8: 14 | AP8: 1 | AQ8: 38 | AR8: 160 | AS8: 44 | AT8: 13 | AU8: 28 | AV8: 7 | AW8: 3 | AX8: 32 | AY8: 27 | AZ8: 17 | BA8: 35 | BB8: 8 | BC8: 23 | BD8: 662 | BE8: 3.5000000000000003E-2
A9: bb011013,bb020207,lc011019,lc011113,ll010906,ll020027,tt011030 | B9: NNN | C9: Grandmother | D9: 0 | E9: 0 | F9: 0 | G9: 0 | H9: 0 | I9: 0 | J9: 0 | K9: 0 | L9: 0 | M9: 0 | N9: 0 | O9: 0 | P9: 0 | Q9: 0 | R9: 0 | S9: 3597 | T9: 0 | U9: 0 | V9: 0 | W9: 0 | X9: 0 | Y9: 0 | Z9: 0 | AA9: 0 | AB9: 0 | AC9: 0 | AD9: 0 | AE9: 81 | AF9: 98 | AG9: 159 | AH9: 123 | AI9: 7 | AJ9: 8 | AK9: 23 | AL9: 1 | AM9: 23 | AN9: 43 | AO9: 28 | AP9: 41 | AQ9: 60 | AR9: 473 | AS9: 90 | AT9: 29 | AU9: 46 | AV9: 21 | AW9: 3 | AX9: 52 | AY9: 33 | AZ9: 102 | BA9: 27 | BB9: 79 | BC9: 24 | BD9: 1650 | BE9: 1.4999999999999999E-2
A10: bb011013 | B10: OBB | C10: Adult | D10: 0 | E10: 0 | F10: 0 | G10: 0 | H10: 0 | I10: 0 | J10: 0 | K10: 0 | L10: 0 | M10: 0 | N10: 0 | O10: 0 | P10: 0 | Q10: 0 | R10: 0 | S10: 0 | T10: 7 | U10: 0 | V10: 0 | W10: 0 | X10: 0 | Y10: 0 | Z10: 0 | AA10: 0 | AB10: 0 | AC10: 0 | AD10: 0 | AE10: 0 | AF10: 0 | AG10: 1 | AH10: 0 | AI10: 0 | AJ10: 0 | AK10: 0 | AL10: 0 | AM10: 0 | AN10: 0 | AO10: 0 | AP10: 0 | AQ10: 0 | AR10: 2 | AS10: 1 | AT10: 0 | AU10: 0 | AV10: 0 | AW10: 0 | AX10: 0 | AY10: 0 | AZ10: 0 | BA10: 0 | BB10: 0 | BC10: 3 | BD10: 4 | BE10: 0.75
A11: bb011013,cx020018,hy011000,hy011121,lc011019,lc020012,lxb011020,lxb020000,tt010903,tt010915,tt011128,wx011118,yy011020,yy020119 | B11: OFF | C11: Adult | D11: 0 | E11: 0 | F11: 0 | G11: 0 | H11: 0 | I11: 0 | J11: 0 | K11: 0 | L11: 0 | M11: 0 | N11: 0 | O11: 0 | P11: 0 | Q11: 0 | R11: 0 | S11: 0 | T11: 0 | U11: 781 | V11: 0 | W11: 0 | X11: 0 | Y11: 0 | Z11: 0 | AA11: 0 | AB11: 0 | AC11: 0 | AD11: 0 | AE11: 7 | AF11: 22 | AG11: 19 | AH11: 15 | AI11: 3 | AJ11: 0 | AK11: 0 | AL11: 2 | AM11: 5 | AN11: 3 | AO11: 4 | AP11: 3 | AQ11: 6 | AR11: 64 | AS11: 13 | AT11: 3 | AU11: 4 | AV11: 0 | AW11: 0 | AX11: 7 | AY11: 2 | AZ11: 10 | BA11: 13 | BB11: 4 | BC11: 20 | BD11: 209 | BE11: 9.6000000000000002E-2
A12: bb011013,ll010906 | B12: SSS | C12: Relative | D12: 0 | E12: 0 | F12: 0 | G12: 0 | H12: 0 | I12: 0 | J12: 0 | K12: 0 | L12: 0 | M12: 0 | N12: 0 | O12: 0 | P12: 0 | Q12: 0 | R12: 0 | S12: 0 | T12: 0 | U12: 0 | V12: 0 | W12: 0 | X12: 0 | Y12: 0 | Z12: 0 | AA12: 37 | AB12: 0 | AC12: 0 | AD12: 0 | AE12: 0 | AF12: 0 | AG12: 5 | AH12: 3 | AI12: 0 | AJ12: 0 | AK12: 0 | AL12: 0 | AM12: 0 | AN12: 0 | AO12: 0 | AP12: 0 | AQ12: 0 | AR12: 5 | AS12: 2 | AT12: 0 | AU12: 0 | AV12: 0 | AW12: 0 | AX12: 0 | AY12: 1 | AZ12: 1 | BA12: 0 | BB12: 0 | BC12: 6 | BD12: 17 | BE12: 0.35299999999999998
A13: bb011013,bb011105,bb020113,yy020000,yy020025,yy020119 | B13: AYY | C13: Adult | D13: 1826 | E13: 0 | F13: 0 | G13: 0 | H13: 0 | I13: 0 | J13: 0 | K13: 0 | L13: 0 | M13: 0 | N13: 0 | O13: 0 | P13: 0 | Q13: 0 | R13: 0 | S13: 0 | T13: 0 | U13: 0 | V13: 0 | W13: 0 | X13: 0 | Y13: 0 | Z13: 0 | AA13: 0 | AB13: 0 | AC13: 0 | AD13: 0 | AE13: 18 | AF13: 52 | AG13: 84 | AH13: 104 | AI13: 5 | AJ13: 3 | AK13: 10 | AL13: 2 | AM13: 15 | AN13: 19 | AO13: 26 | AP13: 40 | AQ13: 51 | AR13: 214 | AS13: 32 | AT13: 36 | AU13: 10 | AV13: 8 | AW13: 1 | AX13: 10 | AY13: 11 | AZ13: 55 | BA13: 31 | BB13: 38 | BC13: 24 | BD13: 875 | BE13: 2.7E-2
A14: bb011105,bb011130,bb020113,bb020207,cx011106,cx011108,hy010828,hy011000,hy011121,lc010921,lc011019,lc011113,lc020012,lc020119,ll010906,lxb010903,lxb011020,lxb011024,lxb020000,lxb020015,lxb020109,tt010903,tt011128,ww011130,ww020105,ww020120,ww020304,wx010927,wx011118,wx020026,wx020104,wx020120 | B14: FAT | C14: Father | D14: 0 | E14: 0 | F14: 0 | G14: 0 | H14: 0 | I14: 0 | J14: 0 | K14: 12261 | L14: 0 | M14: 0 | N14: 0 | O14: 0 | P14: 0 | Q14: 0 | R14: 0 | S14: 0 | T14: 0 | U14: 0 | V14: 0 | W14: 0 | X14: 0 | Y14: 0 | Z14: 0 | AA14: 0 | AB14: 0 | AC14: 0 | AD14: 0 | AE14: 219 | AF14: 375 | AG14: 604 | AH14: 369 | AI14: 23 | AJ14: 10 | AK14: 168 | AL14: 68 | AM14: 138 | AN14: 227 | AO14: 451 | AP14: 83 | AQ14: 204 | AR14: 1305 | AS14: 349 | AT14: 120 | AU14: 167 | AV14: 90 | AW14: 35 | AX14: 76 | AY14: 138 | AZ14: 338 | BA14: 182 | BB14: 141 | BC14: 24 | BD14: 5880 | BE14: 4.0000000000000001E-3
A15: bb011105,bb011130,bb020207,cx011106,cx011108,cx020018,lc011019,ll010906,ll011028,lxb011020,lxb011024,lxb020000,tt010903,tt010915,tt011030,tt020028,ww011028,ww011130,ww020120,ww020304,wx010927,wx011118,wx020026,yy020000,yy020218 | B15: UNC | C15: Unidentified | D15: 0 | E15: 0 | F15: 0 | G15: 0 | H15: 0 | I15: 0 | J15: 0 | K15: 0 | L15: 0 | M15: 0 | N15: 0 | O15: 0 | P15: 0 | Q15: 0 | R15: 0 | S15: 0 | T15: 0 | U15: 0 | V15: 0 | W15: 0 | X15: 0 | Y15: 0 | Z15: 0 | AA15: 0 | AB15: 1116 | AC15: 0 | AD15: 0 | AE15: 5 | AF15: 20 | AG15: 14 | AH15: 107 | AI15: 2 | AJ15: 0 | AK15: 4 | AL15: 0 | AM15: 3 | AN15: 14 | AO15: 6 | AP15: 4 | AQ15: 17 | AR15: 65 | AS15: 12 | AT15: 3 | AU15: 3 | AV15: 9 | AW15: 0 | AX15: 9 | AY15: 3 | AZ15: 21 | BA15: 6 | BB15: 8 | BC15: 21 | BD15: 335 | BE15: 6.3E-2
A16: bb011130,hy011000,tt011030 | B16: JJJ | C16: Mother | D16: 0 | E16: 0 | F16: 0 | G16: 0 | H16: 0 | I16: 0 | J16: 0 | K16: 0 | L16: 0 | M16: 0 | N16: 77 | O16: 0 | P16: 0 | Q16: 0 | R16: 0 | S16: 0 | T16: 0 | U16: 0 | V16: 0 | W16: 0 | X16: 0 | Y16: 0 | Z16: 0 | AA16: 0 | AB16: 0 | AC16: 0 | AD16: 0 | AE16: 2 | AF16: 1 | AG16: 3 | AH16: 2 | AI16: 0 | AJ16: 0 | AK16: 0 | AL16: 0 | AM16: 0 | AN16: 0 | AO16: 2 | AP16: 0 | AQ16: 0 | AR16: 11 | AS16: 2 | AT16: 0 | AU16: 0 | AV16: 1 | AW16: 0 | AX16: 0 | AY16: 0 | AZ16: 0 | BA16: 1 | BB16: 1 | BC16: 10 | BD16: 26 | BE16: 0.38500000000000001
A17: bb011130,ll010906,lxb011024,tt010915,tt011128,yy020218 | B17: YYY | C17: Unidentified | D17: 0 | E17: 0 | F17: 0 | G17: 0 | H17: 0 | I17: 0 | J17: 0 | K17: 0 | L17: 0 | M17: 0 | N17: 0 | O17: 0 | P17: 0 | Q17: 0 | R17: 0 | S17: 0 | T17: 0 | U17: 0 | V17: 0 | W17: 0 | X17: 0 | Y17: 0 | Z17: 0 | AA17: 0 | AB17: 0 | AC17: 0 | AD17: 786 | AE17: 20 | AF17: 13 | AG17: 31 | AH17: 22 | AI17: 3 | AJ17: 0 | AK17: 6 | AL17: 0 | AM17: 6 | AN17: 1 | AO17: 9 | AP17: 4 | AQ17: 8 | AR17: 57 | AS17: 24 | AT17: 3 | AU17: 10 | AV17: 4 | AW17: 0 | AX17: 4 | AY17: 6 | AZ17: 18 | BA17: 1 | BB17: 1 | BC17: 21 | BD17: 251 | BE17: 8.4000000000000005E-2
A18: lc011113 | B18: CAA | C18: Mother | D18: 0 | E18: 0 | F18: 1 | G18: 0 | H18: 0 | I18: 0 | J18: 0 | K18: 0 | L18: 0 | M18: 0 | N18: 0 | O18: 0 | P18: 0 | Q18: 0 | R18: 0 | S18: 0 | T18: 0 | U18: 0 | V18: 0 | W18: 0 | X18: 0 | Y18: 0 | Z18: 0 | AA18: 0 | AB18: 0 | AC18: 0 | AD18: 0 | AE18: 0 | AF18: 0 | AG18: 0 | AH18: 0 | AI18: 0 | AJ18: 0 | AK18: 0 | AL18: 0 | AM18: 0 | AN18: 0 | AO18: 0 | AP18: 0 | AQ18: 0 | AR18: 0 | AS18: 0 | AT18: 0 | AU18: 0 | AV18: 0 | AW18: 0 | AX18: 0 | AY18: 0 | AZ18: 0 | BA18: 0 | BB18: 0 | BC18: 0 | BD18: 0 | BE18: .
A19: lc011113,tt010915 | B19: DDD | C19: Unidentified | D19: 0 | E19: 0 | F19: 0 | G19: 0 | H19: 0 | I19: 101 | J19: 0 | K19: 0 | L19: 0 | M19: 0 | N19: 0 | O19: 0 | P19: 0 | Q19: 0 | R19: 0 | S19: 0 | T19: 0 | U19: 0 | V19: 0 | W19: 0 | X19: 0 | Y19: 0 | Z19: 0 | AA19: 0 | AB19: 0 | AC19: 0 | AD19: 0 | AE19: 0 | AF19: 5 | AG19: 2 | AH19: 3 | AI19: 1 | AJ19: 0 | AK19: 0 | AL19: 0 | AM19: 0 | AN19: 3 | AO19: 0 | AP19: 0 | AQ19: 5 | AR19: 4 | AS19: 1 | AT19: 0 | AU19: 0 | AV19: 1 | AW19: 0 | AX19: 0 | AY19: 0 | AZ19: 1 | BA19: 5 | BB19: 2 | BC19: 12 | BD19: 33 | BE19: 0.36399999999999999
A20: lc011113,ll011028,lxb020000,tt011030 | B20: OPP | C20: Father | D20: 0 | E20: 0 | F20: 0 | G20: 0 | H20: 0 | I20: 0 | J20: 0 | K20: 0 | L20: 0 | M20: 0 | N20: 0 | O20: 0 | P20: 0 | Q20: 0 | R20: 0 | S20: 0 | T20: 0 | U20: 0 | V20: 0 | W20: 0 | X20: 0 | Y20: 257 | Z20: 0 | AA20: 0 | AB20: 0 | AC20: 0 | AD20: 0 | AE20: 7 | AF20: 4 | AG20: 8 | AH20: 14 | AI20: 0 | AJ20: 3 | AK20: 0 | AL20: 0 | AM20: 3 | AN20: 1 | AO20: 2 | AP20: 1 | AQ20: 1 | AR20: 27 | AS20: 6 | AT20: 1 | AU20: 1 | AV20: 1 | AW20: 0 | AX20: 2 | AY20: 2 | AZ20: 6 | BA20: 4 | BB20: 1 | BC20: 20 | BD20: 95 | BE20: 0.21099999999999999
A21: ll010906,ll011028,ll020027 | B21: DGG | C21: Relative | D21: 0 | E21: 0 | F21: 0 | G21: 0 | H21: 0 | I21: 0 | J21: 1413 | K21: 0 | L21: 0 | M21: 0 | N21: 0 | O21: 0 | P21: 0 | Q21: 0 | R21: 0 | S21: 0 | T21: 0 | U21: 0 | V21: 0 | W21: 0 | X21: 0 | Y21: 0 | Z21: 0 | AA21: 0 | AB21: 0 | AC21: 0 | AD21: 0 | AE21: 26 | AF21: 49 | AG21: 74 | AH21: 87 | AI21: 3 | AJ21: 0 | AK21: 30 | AL21: 6 | AM21: 15 | AN21: 28 | AO21: 22 | AP21: 3 | AQ21: 24 | AR21: 213 | AS21: 36 | AT21: 18 | AU21: 30 | AV21: 15 | AW21: 1 | AX21: 12 | AY21: 19 | AZ21: 34 | BA21: 35 | BB21: 10 | BC21: 23 | BD21: 790 | BE21: 2.9000000000000001E-2
A22: ll010906 | B22: JEE | C22: Relative | D22: 0 | E22: 0 | F22: 0 | G22: 0 | H22: 0 | I22: 0 | J22: 0 | K22: 0 | L22: 0 | M22: 172 | N22: 0 | O22: 0 | P22: 0 | Q22: 0 | R22: 0 | S22: 0 | T22: 0 | U22: 0 | V22: 0 | W22: 0 | X22: 0 | Y22: 0 | Z22: 0 | AA22: 0 | AB22: 0 | AC22: 0 | AD22: 0 | AE22: 3 | AF22: 2 | AG22: 4 | AH22: 2 | AI22: 0 | AJ22: 0 | AK22: 2 | AL22: 0 | AM22: 1 | AN22: 2 | AO22: 3 | AP22: 0 | AQ22: 3 | AR22: 8 | AS22: 8 | AT22: 1 | AU22: 4 | AV22: 4 | AW22: 0 | AX22: 2 | AY22: 1 | AZ22: 6 | BA22: 0 | BB22: 4 | BC22: 18 | BD22: 60 | BE22: 0.3
A23: ll010906 | B23: OGG | C23: Relative | D23: 0 | E23: 0 | F23: 0 | G23: 0 | H23: 0 | I23: 0 | J23: 0 | K23: 0 | L23: 0 | M23: 0 | N23: 0 | O23: 0 | P23: 0 | Q23: 0 | R23: 0 | S23: 0 | T23: 0 | U23: 0 | V23: 97 | W23: 0 | X23: 0 | Y23: 0 | Z23: 0 | AA23: 0 | AB23: 0 | AC23: 0 | AD23: 0 | AE23: 2 | AF23: 4 | AG23: 3 | AH23: 5 | AI23: 0 | AJ23: 1 | AK23: 4 | AL23: 0 | AM23: 3 | AN23: 7 | AO23: 0 | AP23: 0 | AQ23: 1 | AR23: 4 | AS23: 2 | AT23: 0 | AU23: 1 | AV23: 0 | AW23: 0 | AX23: 1 | AY23: 0 | AZ23: 5 | BA23: 0 | BB23: 0 | BC23: 14 | BD23: 43 | BE23: 0.32600000000000001
A24: ll010906,ll011028 | B24: XGG | C24: Relative | D24: 0 | E24: 0 | F24: 0 | G24: 0 | H24: 0 | I24: 0 | J24: 0 | K24: 0 | L24: 0 | M24: 0 | N24: 0 | O24: 0 | P24: 0 | Q24: 0 | R24: 0 | S24: 0 | T24: 0 | U24: 0 | V24: 0 | W24: 0 | X24: 0 | Y24: 0 | Z24: 0 | AA24: 0 | AB24: 0 | AC24: 410 | AD24: 0 | AE24: 4 | AF24: 9 | AG24: 8 | AH24: 24 | AI24: 1 | AJ24: 1 | AK24: 9 | AL24: 1 | AM24: 5 | AN24: 18 | AO24: 3 | AP24: 1 | AQ24: 7 | AR24: 15 | AS24: 12 | AT24: 5 | AU24: 4 | AV24: 1 | AW24: 0 | AX24: 2 | AY24: 2 | AZ24: 14 | BA24: 3 | BB24: 0 | BC24: 22 | BD24: 149 | BE24: 0.14799999999999999
A25: ll020027 | B25: MNN | C25: Adult | D25: 0 | E25: 0 | F25: 0 | G25: 0 | H25: 0 | I25: 0 | J25: 0 | K25: 0 | L25: 0 | M25: 0 | N25: 0 | O25: 0 | P25: 0 | Q25: 40 | R25: 0 | S25: 0 | T25: 0 | U25: 0 | V25: 0 | W25: 0 | X25: 0 | Y25: 0 | Z25: 0 | AA25: 0 | AB25: 0 | AC25: 0 | AD25: 0 | AE25: 1 | AF25: 3 | AG25: 5 | AH25: 3 | AI25: 0 | AJ25: 0 | AK25: 0 | AL25: 0 | AM25: 3 | AN25: 0 | AO25: 1 | AP25: 0 | AQ25: 0 | AR25: 6 | AS25: 1 | AT25: 0 | AU25: 1 | AV25: 0 | AW25: 0 | AX25: 2 | AY25: 1 | AZ25: 1 | BA25: 0 | BB25: 0 | BC25: 12 | BD25: 28 | BE25: 0.42899999999999999
A26: ll020027,ww011028 | B26: ONN | C26: Adult | D26: 0 | E26: 0 | F26: 0 | G26: 0 | H26: 0 | I26: 0 | J26: 0 | K26: 0 | L26: 0 | M26: 0 | N26: 0 | O26: 0 | P26: 0 | Q26: 0 | R26: 0 | S26: 0 | T26: 0 | U26: 0 | V26: 0 | W26: 0 | X26: 78 | Y26: 0 | Z26: 0 | AA26: 0 | AB26: 0 | AC26: 0 | AD26: 0 | AE26: 4 | AF26: 1 | AG26: 7 | AH26: 4 | AI26: 0 | AJ26: 0 | AK26: 1 | AL26: 0 | AM26: 2 | AN26: 0 | AO26: 1 | AP26: 0 | AQ26: 3 | AR26: 12 | AS26: 2 | AT26: 0 | AU26: 1 | AV26: 0 | AW26: 0 | AX26: 1 | AY26: 2 | AZ26: 4 | BA26: 5 | BB26: 0 | BC26: 15 | BD26: 50 | BE26: 0.3
A27: tt010915,tt011030,tt020028 | B27: LYY | C27: Mother | D27: 0 | E27: 0 | F27: 0 | G27: 0 | H27: 0 | I27: 0 | J27: 0 | K27: 0 | L27: 0 | M27: 0 | N27: 0 | O27: 0 | P27: 232 | Q27: 0 | R27: 0 | S27: 0 | T27: 0 | U27: 0 | V27: 0 | W27: 0 | X27: 0 | Y27: 0 | Z27: 0 | AA27: 0 | AB27: 0 | AC27: 0 | AD27: 0 | AE27: 5 | AF27: 6 | AG27: 5 | AH27: 1 | AI27: 0 | AJ27: 0 | AK27: 2 | AL27: 0 | AM27: 0 | AN27: 8 | AO27: 2 | AP27: 0 | AQ27: 1 | AR27: 20 | AS27: 4 | AT27: 2 | AU27: 2 | AV27: 0 | AW27: 1 | AX27: 1 | AY27: 1 | AZ27: 4 | BA27: 4 | BB27: 2 | BC27: 18 | BD27: 71 | BE27: 0.254
A28: tt010915,tt011030,tt020028 | B28: LLL | C28: Mother | D28: 0 | E28: 0 | F28: 0 | G28: 0 | H28: 0 | I28: 0 | J28: 0 | K28: 0 | L28: 0 | M28: 0 | N28: 0 | O28: 198 | P28: 0 | Q28: 0 | R28: 0 | S28: 0 | T28: 0 | U28: 0 | V28: 0 | W28: 0 | X28: 0 | Y28: 0 | Z28: 0 | AA28: 0 | AB28: 0 | AC28: 0 | AD28: 0 | AE28: 7 | AF28: 3 | AG28: 9 | AH28: 2 | AI28: 0 | AJ28: 1 | AK28: 5 | AL28: 0 | AM28: 0 | AN28: 3 | AO28: 4 | AP28: 1 | AQ28: 3 | AR28: 15 | AS28: 3 | AT28: 3 | AU28: 2 | AV28: 2 | AW28: 0 | AX28: 1 | AY28: 0 | AZ28: 3 | BA28: 1 | BB28: 2 | BC28: 19 | BD28: 70 | BE28: 0.27100000000000002
A29: yy011020 | B29: OYY | C29: Adult | D29: 0 | E29: 0 | F29: 0 | G29: 0 | H29: 0 | I29: 0 | J29: 0 | K29: 0 | L29: 0 | M29: 0 | N29: 0 | O29: 0 | P29: 0 | Q29: 0 | R29: 0 | S29: 0 | T29: 0 | U29: 0 | V29: 0 | W29: 0 | X29: 0 | Y29: 0 | Z29: 88 | AA29: 0 | AB29: 0 | AC29: 0 | AD29: 0 | AE29: 1 | AF29: 4 | AG29: 2 | AH29: 8 | AI29: 0 | AJ29: 0 | AK29: 0 | AL29: 0 | AM29: 0 | AN29: 0 | AO29: 1 | AP29: 0 | AQ29: 0 | AR29: 7 | AS29: 0 | AT29: 0 | AU29: 0 | AV29: 0 | AW29: 0 | AX29: 3 | AY29: 1 | AZ29: 3 | BA29: 2 | BB29: 0 | BC29: 10 | BD29: 32 | BE29: 0.313
B30: TOTAL w/ CHI | AE30: =SUM(R[-27]C:R[-1]C) -> 1021 | AF30: =SUM(R[-27]C:R[-1]C) -> 2447 | AG30: =SUM(R[-27]C:R[-1]C) -> 3713 | AH30: =SUM(R[-27]C:R[-1]C) -> 3166 | AI30: =SUM(R[-27]C:R[-1]C) -> 191 | AJ30: =SUM(R[-27]C:R[-1]C) -> 113 | AK30: =SUM(R[-27]C:R[-1]C) -> 672 | AL30: =SUM(R[-27]C:R[-1]C) -> 161 | AM30: =SUM(R[-27]C:R[-1]C) -> 794 | AN30: =SUM(R[-27]C:R[-1]C) -> 982 | AO30: =SUM(R[-27]C:R[-1]C) -> 1965 | AP30: =SUM(R[-27]C:R[-1]C) -> 651 | AQ30: =SUM(R[-27]C:R[-1]C) -> 1503 | AR30: =SUM(R[-27]C:R[-1]C) -> 8258 | AS30: =SUM(R[-27]C:R[-1]C) -> 2354 | AT30: =SUM(R[-27]C:R[-1]C) -> 891 | AU30: =SUM(R[-27]C:R[-1]C) -> 1012 | AV30: =SUM(R[-27]C:R[-1]C) -> 622 | AW30: =SUM(R[-27]C:R[-1]C) -> 165 | AX30: =SUM(R[-27]C:R[-1]C) -> 756 | AY30: =SUM(R[-27]C:R[-1]C) -> 911 | AZ30: =SUM(R[-27]C:R[-1]C) -> 1654 | BA30: =SUM(R[-27]C:R[-1]C) -> 1081 | BB30: =SUM(R[-27]C:R[-1]C) -> 1075 | BC30: =SUM(R[-27]C:R[-1]C) -> 472 | BD30: =SUM(R[-27]C:R[-1]C) -> 36158
B31: TOTAL w/o CHI | AE31: =SUM(R[-27]C:R[-2]C) -> 988 | AF31: =SUM(R[-27]C:R[-2]C) -> 2099 | AG31: =SUM(R[-27]C:R[-2]C) -> 3162 | AH31: =SUM(R[-27]C:R[-2]C) -> 2700 | AI31: =SUM(R[-27]C:R[-2]C) -> 169 | AJ31: =SUM(R[-27]C:R[-2]C) -> 102 | AK31: =SUM(R[-27]C:R[-2]C) -> 660 | AL31: =SUM(R[-27]C:R[-2]C) -> 159 | AM31: =SUM(R[-27]C:R[-2]C) -> 755 | AN31: =SUM(R[-27]C:R[-2]C) -> 911 | AO31: =SUM(R[-27]C:R[-2]C) -> 1517 | AP31: =SUM(R[-27]C:R[-2]C) -> 425 | AQ31: =SUM(R[-27]C:R[-2]C) -> 1232 | AR31: =SUM(R[-27]C:R[-2]C) -> 7605 | AS31: =SUM(R[-27]C:R[-2]C) -> 1792 | AT31: =SUM(R[-27]C:R[-2]C) -> 773 | AU31: =SUM(R[-27]C:R[-2]C) -> 927 | AV31: =SUM(R[-27]C:R[-2]C) -> 575 | AW31: =SUM(R[-27]C:R[-2]C) -> 161 | AX31: =SUM(R[-27]C:R[-2]C) -> 677 | AY31: =SUM(R[-27]C:R[-2]C) -> 734 | AZ31: =SUM(R[-27]C:R[-2]C) -> 1458 | BA31: =SUM(R[-27]C:R[-2]C) -> 1011 | BB31: =SUM(R[-27]C:R[-2]C) -> 810 | BC31: =SUM(R[-27]C:R[-2]C) -> 448 | BD31: =SUM(R[-27]C:R[-2]C) -> 31402
AJ32: =SUM(R[-27]C:R[-27]C[1])+SUM(R[-16]C:R[-16]C[1])+SUM(R[-14]C:R[-14]C[1])+SUM(R[-5]C:R[-4]C[1]) -> 423 | AK32: =SUM(R[-1]C[-1]:R[-1]C) -> 762 | AO32: =SUM(R[-27]C[-3]:R[-27]C[1])+SUM(R[-16]C[-3]:R[-16]C[1])+SUM(R[-14]C[-3]:R[-14]C[1])+SUM(R[-5]C[-3]:R[-4]C[1]) -> 2014 | AP32: =SUM(R[-1]C[-4]:R[-1]C) -> 3767